[
  {
    "id": "SC-001",
    "category": "C01",
    "title": "侧窗光职业肖像",
    "mode": "R",
    "style": "自然写实摄影",
    "mechanism": "面部身份保持与单侧柔光塑形",
    "scene": "为虚构的陶艺工作室主理人制作半身照",
    "input_count": 1,
    "acceptance": "五官比例稳定；皮肤纹理自然；眼部有焦点",
    "phase": "pilot"
  },
  {
    "id": "SC-002",
    "category": "C01",
    "title": "直闪日常抓拍",
    "mode": "G",
    "style": "自然写实摄影",
    "mechanism": "近距离直闪与环境曝光反差",
    "scene": "旧书仓库打烊后的朋友合影",
    "input_count": 0,
    "acceptance": "闪光方向统一；保留随手拍构图",
    "phase": "first100"
  },
  {
    "id": "SC-003",
    "category": "C01",
    "title": "颗粒胶片情绪肖像",
    "mode": "G",
    "style": "模拟胶片摄影",
    "mechanism": "颗粒与柔和高光共同塑造情绪",
    "scene": "黄昏码头候船的成年旅人",
    "input_count": 0,
    "acceptance": "颗粒不覆盖五官；暗部保留层次",
    "phase": "first100"
  },
  {
    "id": "SC-004",
    "category": "C01",
    "title": "黑白硬光肖像",
    "mode": "G",
    "style": "黑白摄影",
    "mechanism": "明暗交界与轮廓组织面部",
    "scene": "维修车间里戴圆框眼镜的钟表师",
    "input_count": 0,
    "acceptance": "阴影方向一致；黑白层次可分",
    "phase": "first100"
  },
  {
    "id": "SC-005",
    "category": "C01",
    "title": "鱼眼近距合影",
    "mode": "G",
    "style": "自然写实摄影",
    "mechanism": "广角边缘变形与多人视线汇聚",
    "scene": "温室步道上的三位成年植物研究者",
    "input_count": 0,
    "acceptance": "中心人物比例合理；肢体数量正确",
    "phase": "first100"
  },
  {
    "id": "SC-006",
    "category": "C01",
    "title": "双重曝光肖像",
    "mode": "G",
    "style": "超现实摄影",
    "mechanism": "人物轮廓内叠加第二个场景",
    "scene": "侧脸剪影内部出现潮间带与灯塔",
    "input_count": 0,
    "acceptance": "轮廓可辨；双层图像有明确主次",
    "phase": "first100"
  },
  {
    "id": "SC-007",
    "category": "C01",
    "title": "雨窗隔玻璃肖像",
    "mode": "G",
    "style": "电影感摄影",
    "mechanism": "玻璃雨滴与人物形成前后焦面",
    "scene": "夜班巴士车窗旁的成年乘客",
    "input_count": 0,
    "acceptance": "雨滴位于玻璃表面；面部不被随机扭曲",
    "phase": "expansion"
  },
  {
    "id": "SC-008",
    "category": "C01",
    "title": "镜面自拍构图",
    "mode": "G",
    "style": "自然写实摄影",
    "mechanism": "镜像关系与相机遮挡的自洽",
    "scene": "试衣间镜前记录复古运动穿搭",
    "input_count": 0,
    "acceptance": "手与手机姿态合理；镜像不增生人物",
    "phase": "expansion"
  },
  {
    "id": "SC-009",
    "category": "C01",
    "title": "极端仰视人物",
    "mode": "R",
    "style": "电影感摄影",
    "mechanism": "保持人物身份并显著降低机位",
    "scene": "成年攀岩教练站在室内岩壁前",
    "input_count": 1,
    "acceptance": "五官可识别；仰视透视贯穿全身",
    "phase": "expansion"
  },
  {
    "id": "SC-010",
    "category": "C01",
    "title": "动作定格运动照",
    "mode": "G",
    "style": "自然写实摄影",
    "mechanism": "主体锐利与背景运动拖影对照",
    "scene": "木质场馆中跃起接球的成年运动员",
    "input_count": 0,
    "acceptance": "动作重心成立；运动方向一致",
    "phase": "expansion"
  },
  {
    "id": "SC-011",
    "category": "C01",
    "title": "微距皮肤与织物",
    "mode": "G",
    "style": "自然写实摄影",
    "mechanism": "以真实细节呈现接触面和尺度",
    "scene": "手腕、亚麻袖口与黄铜手镯的局部",
    "input_count": 0,
    "acceptance": "织纹和皮肤尺度相容；不过度磨皮",
    "phase": "expansion"
  },
  {
    "id": "SC-012",
    "category": "C01",
    "title": "环境叙事肖像",
    "mode": "G",
    "style": "自然写实摄影",
    "mechanism": "人物与职业物件共同讲述场景",
    "scene": "深夜修复地图的档案工作人员",
    "input_count": 0,
    "acceptance": "物件有用途；人物仍为视觉中心",
    "phase": "expansion"
  },
  {
    "id": "SC-013",
    "category": "C01",
    "title": "参考姿态人像",
    "mode": "R",
    "style": "自然写实摄影",
    "mechanism": "从姿态图迁移身体姿势并保持身份",
    "scene": "让虚构人物复现侧坐转身姿态",
    "input_count": 2,
    "acceptance": "姿态关键点对应；身份与衣着保持",
    "phase": "expansion"
  },
  {
    "id": "SC-014",
    "category": "C01",
    "title": "参考表情人像",
    "mode": "R",
    "style": "自然写实摄影",
    "mechanism": "局部表情迁移且保留面部结构",
    "scene": "同一成年人物从平静转为惊喜",
    "input_count": 2,
    "acceptance": "眉眼嘴角表达统一；脸型稳定",
    "phase": "expansion"
  },
  {
    "id": "SC-015",
    "category": "C01",
    "title": "舞台轮廓光人物",
    "mode": "G",
    "style": "电影感摄影",
    "mechanism": "边缘光将人物从暗背景分离",
    "scene": "舞台侧幕中准备上场的成年舞者",
    "input_count": 0,
    "acceptance": "轮廓光来自合理位置；不淹没面部",
    "phase": "expansion"
  },
  {
    "id": "SC-016",
    "category": "C01",
    "title": "同一人物年代写真",
    "mode": "R",
    "style": "模拟胶片摄影",
    "mechanism": "身份保持下改变摄影年代语言",
    "scene": "一位虚构成年人物的三个年代肖像",
    "input_count": 1,
    "acceptance": "身份一致；服饰与颗粒呈现年代差异",
    "phase": "expansion"
  },
  {
    "id": "SC-017",
    "category": "C01",
    "title": "霓虹都市肖像",
    "mode": "G",
    "style": "赛博霓虹",
    "mechanism": "人造光色与湿润反射建立未来都市语言",
    "scene": "架空城市中下夜班的成年单车信使",
    "input_count": 0,
    "acceptance": "综合色光方向连贯；保留都市科技感",
    "phase": "expansion"
  },
  {
    "id": "SC-018",
    "category": "C02",
    "title": "雨后街角纪实",
    "mode": "G",
    "style": "自然写实摄影",
    "mechanism": "地面反射与街道透视共同引导视线",
    "scene": "清晨海港小镇的报刊亭与自行车",
    "input_count": 0,
    "acceptance": "反射对应实物；空间尺度合理",
    "phase": "pilot"
  },
  {
    "id": "SC-019",
    "category": "C02",
    "title": "夜间长曝光街景",
    "mode": "G",
    "style": "自然写实摄影",
    "mechanism": "固定建筑与连续光轨形成时间差",
    "scene": "山城有轨电车驶过弯道",
    "input_count": 0,
    "acceptance": "光轨沿道路延伸；建筑保持稳定",
    "phase": "first100"
  },
  {
    "id": "SC-020",
    "category": "C02",
    "title": "自然风景空气透视",
    "mode": "G",
    "style": "自然写实摄影",
    "mechanism": "近中远景依靠雾气与色调分层",
    "scene": "雨季河谷中交叠的梯田和山脊",
    "input_count": 0,
    "acceptance": "远景对比逐层降低；不出现重复山体",
    "phase": "first100"
  },
  {
    "id": "SC-021",
    "category": "C02",
    "title": "水面镜像风景",
    "mode": "G",
    "style": "自然写实摄影",
    "mechanism": "真实倒影和细小水纹共同构图",
    "scene": "晨雾中的木栈桥与芦苇湿地",
    "input_count": 0,
    "acceptance": "倒影方向及位置对应；水面有连续性",
    "phase": "first100"
  },
  {
    "id": "SC-022",
    "category": "C02",
    "title": "动物自然瞬间",
    "mode": "G",
    "style": "自然写实摄影",
    "mechanism": "动物行为与环境形成明确互动",
    "scene": "潮退后的沙滩上翻找贝壳的水鸟",
    "input_count": 0,
    "acceptance": "物种外形可信；脚与地面接触自然",
    "phase": "first100"
  },
  {
    "id": "SC-023",
    "category": "C02",
    "title": "植物微距观察",
    "mode": "G",
    "style": "自然写实摄影",
    "mechanism": "浅景深突出细小生物结构",
    "scene": "雨后苔藓上的孢蒴与水滴",
    "input_count": 0,
    "acceptance": "清晰区集中；水滴折射不过度",
    "phase": "first100"
  },
  {
    "id": "SC-024",
    "category": "C02",
    "title": "水下环境摄影",
    "mode": "G",
    "style": "自然写实摄影",
    "mechanism": "水体散射和焦散塑造深度",
    "scene": "浅海海草床中的银色鱼群",
    "input_count": 0,
    "acceptance": "水面光向统一；鱼体不融合",
    "phase": "expansion"
  },
  {
    "id": "SC-025",
    "category": "C02",
    "title": "星空与地景",
    "mode": "G",
    "style": "自然写实摄影",
    "mechanism": "天空尺度与暗部地景保持可读性",
    "scene": "荒原观测站上方的星空",
    "input_count": 0,
    "acceptance": "地平线稳定；星点没有无规律拖线",
    "phase": "expansion"
  },
  {
    "id": "SC-026",
    "category": "C02",
    "title": "旅行静物手账照",
    "mode": "G",
    "style": "模拟胶片摄影",
    "mechanism": "通过使用痕迹和散置物件交代旅程",
    "scene": "木桌上的路线便笺、海玻璃和折叠地图",
    "input_count": 0,
    "acceptance": "物件相互遮挡合理；纸张文字可控",
    "phase": "expansion"
  },
  {
    "id": "SC-027",
    "category": "C02",
    "title": "四季同机位景观",
    "mode": "R",
    "style": "自然写实摄影",
    "mechanism": "固定构图与建筑结构下改变季节",
    "scene": "同一座乡间桥梁的四季对照",
    "input_count": 1,
    "acceptance": "桥和相机位置一致；季节变化清晰",
    "phase": "expansion"
  },
  {
    "id": "SC-028",
    "category": "C02",
    "title": "室内外跨窗景观",
    "mode": "G",
    "style": "自然写实摄影",
    "mechanism": "窗框形成内外两层光照与叙事",
    "scene": "雨夜阁楼里的书桌望向远处街灯",
    "input_count": 0,
    "acceptance": "室内外曝光协调；玻璃反射有依据",
    "phase": "expansion"
  },
  {
    "id": "SC-029",
    "category": "C02",
    "title": "全景环境环视图",
    "mode": "G",
    "style": "自然写实摄影",
    "mechanism": "连续环视空间的等距柱状展开",
    "scene": "虚构天文馆圆形大厅的全景概念图",
    "input_count": 0,
    "acceptance": "两侧接缝可检查；标为概念图而非已验证全景资产",
    "phase": "expansion"
  },
  {
    "id": "SC-030",
    "category": "C03",
    "title": "棚拍商品主图",
    "mode": "R",
    "style": "商业棚拍",
    "mechanism": "保持产品外形并重建背景与布光",
    "scene": "将自制无品牌陶瓷随行杯置于暖灰背景",
    "input_count": 1,
    "acceptance": "杯口与把手形状一致；边缘和阴影清楚",
    "phase": "pilot"
  },
  {
    "id": "SC-031",
    "category": "C03",
    "title": "产品悬浮陈列",
    "mode": "G",
    "style": "商业棚拍",
    "mechanism": "多个部件沿主轴悬浮并保持物理关系",
    "scene": "便携磨豆器与三件配件的展示",
    "input_count": 0,
    "acceptance": "悬浮层次明确；配件不重复",
    "phase": "first100"
  },
  {
    "id": "SC-032",
    "category": "C03",
    "title": "食材分层爆炸图",
    "mode": "G",
    "style": "商业棚拍",
    "mechanism": "按食物结构拆开食材层级",
    "scene": "蘑菇烤蔬三明治的垂直分层",
    "input_count": 0,
    "acceptance": "食材顺序正确；每层边界完整",
    "phase": "first100"
  },
  {
    "id": "SC-033",
    "category": "C03",
    "title": "饮料飞溅广告",
    "mode": "G",
    "style": "商业棚拍",
    "mechanism": "液体飞溅围绕产品形成方向性动势",
    "scene": "青柠气泡水与玻璃杯的夏日广告",
    "input_count": 0,
    "acceptance": "液体与杯体遮挡合理；飞溅方向统一",
    "phase": "first100"
  },
  {
    "id": "SC-034",
    "category": "C03",
    "title": "单品多色陈列",
    "mode": "R",
    "style": "商业棚拍",
    "mechanism": "同款产品只改变指定颜色并排对比",
    "scene": "六种釉色的自制陶瓷花器",
    "input_count": 1,
    "acceptance": "产品形状相同；颜色数量准确",
    "phase": "first100"
  },
  {
    "id": "SC-035",
    "category": "C03",
    "title": "俯拍整齐排物",
    "mode": "G",
    "style": "商业棚拍",
    "mechanism": "物件按网格展开并呈现统一尺度",
    "scene": "轻量露营炊具的出行清单",
    "input_count": 0,
    "acceptance": "网格间距均匀；物件没有缺角",
    "phase": "first100"
  },
  {
    "id": "SC-036",
    "category": "C03",
    "title": "透明包装透视",
    "mode": "G",
    "style": "商业棚拍",
    "mechanism": "兼顾外包装反射与内部产品可见性",
    "scene": "装有彩色果冻的透明方盒",
    "input_count": 0,
    "acceptance": "包装轮廓完整；内外折射有区分",
    "phase": "expansion"
  },
  {
    "id": "SC-037",
    "category": "C03",
    "title": "微距质感卖点",
    "mode": "G",
    "style": "商业棚拍",
    "mechanism": "局部放大展示材质而不丢失主体结构",
    "scene": "编织耳机头梁和金属转轴的特写",
    "input_count": 0,
    "acceptance": "材质边界明确；微距比例成立",
    "phase": "expansion"
  },
  {
    "id": "SC-038",
    "category": "C03",
    "title": "热食蒸汽摄影",
    "mode": "G",
    "style": "商业棚拍",
    "mechanism": "蒸汽层次与食品表面质感共同表现温度",
    "scene": "刚出炉的南瓜浓汤和粗陶汤碗",
    "input_count": 0,
    "acceptance": "蒸汽来自热源；食物表面仍可辨",
    "phase": "expansion"
  },
  {
    "id": "SC-039",